{
  "schema_version": 1,
  "stage": "flux",
  "run_id": "11111111-1111-4111-8111-111111111111",
  "invocation_id": "22222222-2222-4222-8222-222222222222",
  "deadline_unix_ms": 4102444800000,
  "prompt": "Editorial illustration of neighbors planting trees beside a library.",
  "seed": 42,
  "width": 1024,
  "height": 1024,
  "num_inference_steps": 4,
  "guidance_scale": 1.0,
  "output_format": "webp"
}
